{
  "audit_schema_version": "ao.forge.goal-run-update-audit.v0.1",
  "goal_run": "examples/goals/ao2-weekend-hardening.goal-run.json",
  "out": "tmp/ao2-weekend-hardening.goal-run.json",
  "goal_id": "ao2-weekend-hardening",
  "previous_phase": "planning",
  "current_phase": "implementation",
  "phase_transition": "planning->implementation",
  "updated_fields": [
    "current_phase",
    "next_task",
    "last_verified_at",
    "last_iteration.status",
    "last_iteration.summary",
    "last_iteration.evidence"
  ],
  "last_verified_at": "2026-06-19T14:30:00Z",
  "last_iteration_status": "passed",
  "last_iteration_summary": "Transitioned from planning with a bounded implementation task.",
  "evidence": [
    {
      "label": "ao2-weekend-hardening.goal-run.json",
      "path": "examples/goals/ao2-weekend-hardening.goal-run.json",
      "sha256": "4e93b5d19c3b26c019977d3a483caa24c678786cb568bf47ac3d707d797a1d3a"
    }
  ],
  "status": "updated"
}
